"Formula ID","Block","Name","Formula","Description","Level / Stage","Input / Source","Variable IDs","Reference IDs","Output / Next","Used In","Source Scope","Implementation Status","Data Readiness","Related Formula IDs","Test Assumption","Normalization Notes"
"TBE-BRK-001","Broker Payout","Broker Commission Base","brokerCommissionBase = approvedRevenueBase - excludedFees","Определяет базу, от которой считается выплата broker. Некоторые fees могут исключаться.","","Final price, service fees, excluded fee list.","","","Broker commission.","Комиссия считается от total customer price или только от net revenue?","TO-BE","Approved for Formula Sprint","Test Assumption","","Use normalized registry example values and current local reference seeds for tests; replace with governed production values before release.","Review mapping: Variable mapping"
"TBE-BRK-002","Broker Payout","Broker Commission","brokerCommission = brokerCommissionBase x brokerCommissionRate","Считает выплату broker как процент от утвержденной базы.","","Commission base, broker commission rate.","VAR-TBE-002; VAR-TBE-018","","Broker payout, net margin.","Rate единый или зависит от source/channel/broker?","TO-BE","Approved for Formula Sprint","Test Assumption","","Use normalized registry example values and current local reference seeds for tests; replace with governed production values before release.",""
"TBE-BRK-003","Broker Payout","Broker Minimum / Cap","brokerPayout = min(max(calculatedCommission, minPayout), maxPayout)","Ограничивает broker payout минимумом/максимумом, чтобы выплаты были предсказуемы.","","Calculated commission, payout min/max.","","","Broker payout, final profitability.","Нужны ли cap/floor для broker payout?","TO-BE","Approved for Formula Sprint","Ready","","",""
"TBE-BRK-004","Broker Payout","Broker Payout Eligibility","eligiblePayout = IF(orderStatus/paymentStatus qualifies, brokerPayout, 0)","Проверяет, когда broker payout должен начисляться: после estimate, invoice, payment, pickup или delivery.","","Order status, payment status, payout policy.","","","Broker payout accrual.","На каком событии начисляется broker payout?","TO-BE","Approved for Formula Sprint","Ready","","",""
"TBE-DSP-001","Dispatcher Payout","Dispatcher Payout Base","dispatcherPayoutBase = ordersHandled x ratePerOrder OR revenueBase x dispatcherRate","Определяет базу для выплаты dispatcher: per order, процент от revenue или гибрид.","","Orders handled, revenue base, dispatcher plan.","","","Dispatcher payout.","Dispatcher paid per order, per stage, per revenue or KPI?","TO-BE","Approved for Formula Sprint","Test Assumption","","Use normalized registry example values and current local reference seeds for tests; replace with governed production values before release.","Review mapping: Variable mapping"
"TBE-DSP-002","Dispatcher Payout","Dispatcher Payout","dispatcherPayout = dispatcherPayoutBase + bonus - penalty","Считает итоговую выплату dispatcher с бонусами/штрафами, если они применяются.","","Dispatcher base, bonus rules, penalty rules.","","","Payroll/admin payout, profitability.","Нужны ли bonus/penalty в MVP?","TO-BE","Approved for Formula Sprint","Ready","TBE-MRG-014","",""
"TBE-DSP-003","Dispatcher Payout","Dispatcher Stage Allocation","dispatcherStageCost = dispatcherPayout x stageShare","Распределяет dispatcher payout по pickup/interstate/delivery, чтобы stage margin был честным.","","Dispatcher payout, stage share rule.","","REF-TBE-005","Stage cost and margin.","Allocation по revenue, labor hours или equal split?","TO-BE","Approved for Formula Sprint","Test Assumption","","Use normalized registry example values and current local reference seeds for tests; replace with governed production values before release.",""
"TBE-COST-001","Cost Base","Direct Operational Cost","directCost = pickupCost + interstateCost + deliveryCost + serviceFees","Собирает прямую себестоимость заказа до overhead, payouts, margin и discounts.","","Stage subtotals, service fees.","","","Fully loaded cost, margin calculation.","Какие fees являются direct cost, а какие pass-through?","TO-BE","Approved for Formula Sprint","Test Assumption","","Use normalized registry example values and current local reference seeds for tests; replace with governed production values before release.","Review mapping: Variable mapping"
"TBE-COST-002","Cost Base","Fully Loaded Cost","fullyLoadedCost = directCost + payrollBurden + brokerPayout + dispatcherPayout + overheadAllocation","Считает полную себестоимость заказа для правильной маржинальности.","","Direct cost, payroll, payouts, overhead.","","","Gross/contribution margin, price floor.","Включать overhead в quote price или только в profitability audit?","TO-BE","Approved for Formula Sprint","Ready","","",""
"TBE-COST-003","Cost Allocation","Item Cost Allocation","itemCostShare = itemEffectiveVolume / totalEffectiveVolume x allocatableCost","Распределяет cost по item для audit/ref price, не как declared value.","","Item effective volume, total effective volume, allocatable cost.","","","Item-level audit, internal allocation.","Allocation делать по volume, weight или hybrid?","TO-BE","Approved for Formula Sprint","Ready","","",""
"TBE-COST-004","Cost Allocation","Stage Cost Allocation","stageCostShare = stageCost / totalCost","Показывает, какая доля себестоимости пришлась на pickup/interstate/delivery.","","Stage costs, total cost.","","","Stage margin dashboard, CEO audit.","Нужны ли stage margin targets?","TO-BE","Approved for Formula Sprint","Ready","","",""
"TBE-MGN-003","Margin","Gross Margin Dollars","grossMargin = customerRevenue - directOperationalCost","Считает gross margin в долларах до fully loaded payouts/overhead.","","Customer revenue, direct cost.","","","CEO profitability view.","Gross margin считать до или после broker/dispatcher payouts?","TO-BE","Approved for Formula Sprint","Ready","","",""
"TBE-MGN-004","Margin","Gross Margin Percent","grossMarginPct = grossMargin / customerRevenue","Показывает gross margin в процентах от customer revenue.","","Gross margin, customer revenue.","","","Margin guardrails, reporting.","Какой minimum gross margin допустим?","TO-BE","Approved for Formula Sprint","Ready","","",""
"TBE-MGN-005","Margin","Contribution Margin Dollars","contributionMargin = customerRevenue - fullyLoadedCost","Считает contribution margin после payroll burden, broker/dispatcher payouts и approved overhead.","","Customer revenue, fully loaded cost.","","","Profitability guardrail.","Используем contribution margin как главный контроль?","TO-BE","Approved for Formula Sprint","Ready","","",""
"TBE-MGN-006","Margin","Contribution Margin Percent","contributionMarginPct = contributionMargin / customerRevenue","Показывает реальную маржинальность заказа после всех ключевых выплат и cost components.","","Contribution margin, customer revenue.","","","CEO/CFO margin dashboard.","Какой target contribution margin?","TO-BE","Approved for Formula Sprint","Ready","","",""
"TBE-MGN-007","Margin","Minimum Margin Guardrail","isMarginOk = contributionMarginPct >= minContributionMarginPct","Блокирует или помечает quote, если цена ниже минимальной маржинальности.","","Contribution margin pct, minimum margin pct.","VAR-TBE-020","","Warning/blocker, discount approval.","Это warning или blocker для estimate generation?","TO-BE","Approved for Formula Sprint","Test Assumption","","Use normalized registry example values and current local reference seeds for tests; replace with governed production values before release.",""
"TBE-MGN-008","Margin","Price Floor","priceFloor = fullyLoadedCost / (1 - minContributionMarginPct)","Считает минимальную customer price, ниже которой заказ не должен продаваться.","","Fully loaded cost, minimum margin pct.","VAR-TBE-020","","Discount guardrail, final quote check.","Показывать price floor broker/admin?","TO-BE","Approved for Formula Sprint","Test Assumption","","Use normalized registry example values and current local reference seeds for tests; replace with governed production values before release.",""
"TBE-MGN-009","Discount","Maximum Allowed Discount","maxDiscount = rawCustomerPrice - priceFloor","Считает максимальную скидку, которую можно дать без нарушения margin floor.","","Raw customer price, price floor.","","","Discount approval, warning/blocker.","Кто может override max discount?","TO-BE","Approved for Formula Sprint","Ready","","",""
"TBE-MGN-010","Discount","Post-Discount Margin Check","postDiscountMarginPct = (discountedPrice - fullyLoadedCost) / discountedPrice","Пересчитывает margin после скидки, чтобы discount не разрушал прибыльность.","","Discounted price, fully loaded cost.","","","Final approval, audit.","Какая минимальная post-discount margin?","TO-BE","Approved for Formula Sprint","Ready","","",""
"TBE-CAP-001","Capacity","Vehicle Space Utilization","vehicleUtilization = totalEffectiveVolume / selectedVehicleCapacity","Показывает, насколько выбранная машина заполнена по operational volume.","","Effective volume, selected vehicle capacity.","","","Vehicle fit, capacity warning, pricing premium.","Какой utilization считается нормальным/опасным?","TO-BE","Approved for Formula Sprint","Test Assumption","INT-CAP-002-VOLUME-UTILIZATION; FIT-002-CAPACITY-FIT-BY-VOLUME","Use normalized registry example values and current local reference seeds for tests; replace with governed production values before release.","Review mapping: Reference mapping"
"TBE-CAP-002","Capacity","Payload Utilization","payloadUtilization = totalWeight / selectedVehiclePayload","Показывает загрузку vehicle по весу, отдельно от объема.","","Total weight, selected vehicle payload.","","","Vehicle fit, safety/ops warning.","Какие payload thresholds trigger review?","TO-BE","Approved for Formula Sprint","Test Assumption","INT-CAP-003-PAYLOAD-UTILIZATION; FIT-003-CAPACITY-FIT-BY-WEIGHT","Use normalized registry example values and current local reference seeds for tests; replace with governed production values before release.","Review mapping: Variable mapping, Reference mapping"
"TBE-CAP-003","Capacity","Route Capacity Opportunity Cost","capacityOpportunityCost = reservedCapacity x routeCapacityRate","Оценивает стоимость занятой capacity на route, особенно для bulky/moving orders.","","Reserved capacity, route capacity rate.","VAR-TBE-022","","Bulky premium, margin guardrail.","Нужно ли учитывать opportunity cost в customer price?","TO-BE","Approved for Formula Sprint","Test Assumption","","Use normalized registry example values and current local reference seeds for tests; replace with governed production values before release.",""
"TBE-CAP-004","Capacity","Bulky Capacity Premium","bulkyCapacityPremium = capacityOpportunityCost x bulkyPremiumMultiplier","Добавляет premium, когда заказ занимает слишком много capacity и мешает consolidated economics.","","Capacity opportunity cost, bulky multiplier.","VAR-TBE-023","","Service fee or route premium.","Premium фиксированный, процентный или manual?","TO-BE","Approved for Formula Sprint","Test Assumption","WARN-002-BULKY-ORDER","Use normalized registry example values and current local reference seeds for tests; replace with governed production values before release.",""
"TBE-REV-001","Revenue","Customer Revenue","customerRevenue = finalCustomerPrice - passThroughExcludedAmounts","Определяет revenue base для margin, commissions and reporting.","","Final price, pass-through fees.","","","Margin, broker payout, reporting.","Какие amounts исключать из revenue base?","TO-BE","Approved for Formula Sprint","Test Assumption","","Use normalized registry example values and current local reference seeds for tests; replace with governed production values before release.","Review mapping: Variable mapping"
"TBE-REV-002","Revenue","Stage Revenue Allocation","stageRevenue = customerRevenue x stageCost / totalCost","Распределяет revenue по pickup/interstate/delivery пропорционально cost, чтобы видеть stage margin.","","Customer revenue, stage cost shares.","","","Stage margin dashboard.","Revenue allocation по cost, price components или manual split?","TO-BE","Approved for Formula Sprint","Ready","","",""
"TBE-ADJ-001","Adjustments","Approved Manual Override Impact","overrideImpact = approvedOverrideAmount; finalImpact stored with reason and owner","Любой manual override должен иметь reason, owner и audit trail, чтобы не скрывать margin leakage.","","Approved override, reason, owner.","","","Final price, margin audit, change log.","Какие роли могут делать override?","TO-BE","Approved for Formula Sprint","Ready","","",""
"TBE-LOC-001","Location / Address Type","Address Type Normalization","normalizedAddressType = MAP(rawAddressType, LocationTypeReference)","Тип точки из UI должен нормализоваться в единый справочник. Это нужно, чтобы House, Apartments, Business, Warehouse и Auction одинаково использовались в pickup и delivery расчетах.","","Pickup/delivery addressType from Quote Draft access section; Location / Address Types reference.","","REF-TBE-016","Pickup/delivery time model, access effort, crew planning.","Утверждаем ли этот location type фактор для Formula Sprint?","TO-BE","Approved for Formula Sprint","Test Assumption","","Use normalized registry example values and current local reference seeds for tests; replace with governed production values before release.",""
"TBE-LOC-002","Location / Address Type","Location Type Time Impact","locationTimeMinutes = baseStageMinutes x locationTypeTimeMultiplier + locationTypeFixedMinutes","Тип точки должен увеличивать или уменьшать расчетное время stage. Например, apartment может добавить время доступа, warehouse может снизить handling time, auction может добавить waiting/release time.","","Normalized address type; Location / Address Types reference; historical time metrics.","VAR-TBE-024; VAR-TBE-025","REF-TBE-005; REF-TBE-016; REF-TIME-001","Pickup minutes, delivery minutes, labor hours, fully loaded labor cost.","Какие multipliers и fixed minutes утверждаем для House/Apartments/Business/Warehouse/Auction?","TO-BE","Approved for Formula Sprint","Test Assumption","","Use normalized registry example values and current local reference seeds for tests; replace with governed production values before release.",""
"TBE-LOC-003","Location / Address Type","Location Type Crew Impact","recommendedCrew = baseCrew + locationTypeCrewImpact + accessCrewImpact","Тип точки должен влиять на рекомендуемый crew, если локация требует больше людей или создает ограничения доступа. Это planning input, не скрытая ручная наценка.","","Location / Address Types reference; Access Conditions; crew rules.","VAR-TBE-026","REF-011; REF-TBE-005; REF-TBE-016","Vehicle/crew split, labor cost, capacity planning.","Утверждаем ли этот location type фактор для Formula Sprint?","TO-BE","Approved for Formula Sprint","Test Assumption","","Use normalized registry example values and current local reference seeds for tests; replace with governed production values before release.",""
"TBE-LOC-004","Location / Address Type","Parking / Loading Complexity","accessEffortMinutes = parkingLoadingComplexityMinutes + loadingDockPenalty + waitTimeAllowance","Для точки нужно учитывать не только этаж/лифт, но и парковку, loading dock, building access и ожидание. Эти минуты идут в stage time и стоимость труда.","","Location / Address Types reference; Access Conditions; historical time metrics.","VAR-TBE-027","REF-011; REF-TBE-005; REF-TBE-016; REF-TIME-001","Pickup/delivery labor minutes and access risk.","Утверждаем ли этот location type фактор для Formula Sprint?","TO-BE","Approved for Formula Sprint","Test Assumption","","Use normalized registry example values and current local reference seeds for tests; replace with governed production values before release.",""
"TBE-LOC-005","Location / Address Type","Warehouse Efficiency Adjustment","adjustedHandlingMinutes = handlingMinutes x warehouseEfficiencyFactor","Warehouse/business точка может быть быстрее, если есть dock/loading process. Коэффициент должен быть в справочнике, чтобы не hardcode в формуле.","","Location / Address Types reference; loading dock/default access fields.","VAR-TBE-028","REF-TBE-005; REF-TBE-016","Pickup/delivery handling time, labor cost.","Утверждаем ли этот location type фактор для Formula Sprint?","TO-BE","Approved for Formula Sprint","Test Assumption","","Use normalized registry example values and current local reference seeds for tests; replace with governed production values before release.",""
"TBE-LOC-006","Location / Address Type","Auction Handling Adjustment","auctionHandlingCost = auctionHandlingMinutes / 60 x fullyLoadedHourlyRate x crewSize","Auction требует отдельного handling allowance: ожидание, release, документы, ограниченные окна. Без этого калькулятор может недооценивать labor cost.","","Location / Address Types reference; payroll/wage rates; historical time metrics.","VAR-TBE-029","REF-TBE-005; REF-TBE-016; REF-TIME-001","Pickup/delivery labor cost, margin guardrail.","Нужен ли отдельный auction fee или достаточно labor time adjustment?","TO-BE","Approved for Formula Sprint","Test Assumption","","Use normalized registry example values and current local reference seeds for tests; replace with governed production values before release.",""
"TBE-LOC-007","Location / Address Type","Location Effort Score","locationEffortScore = accessComplexityMultiplier + parkingComplexityScore + waitRiskScore + locationTypeCrewImpact","Сводный effort score показывает операционную сложность точки. Он не заменяет деньги напрямую, а помогает объяснить, почему выросли time, crew или risk reserve.","","Location / Address Types reference; Access Conditions; historical time metrics.","VAR-TBE-026","REF-011; REF-TBE-016; REF-TIME-001","Time model, crew planning, margin guardrail, audit trace.","Утверждаем ли этот location type фактор для Formula Sprint?","TO-BE","Approved for Formula Sprint","Test Assumption","","Use normalized registry example values and current local reference seeds for tests; replace with governed production values before release.",""
"TBE-LOC-008","Location / Address Type","Location Risk Reserve","locationRiskReserve = locationLaborCost x locationRiskReservePct when confidence is low or effortScore exceeds threshold","Если тип точки исторически дает высокий риск ожидания/переработки, модель должна показывать отдельный reserve, чтобы CEO видел источник защиты маржи.","","Location effort score; time confidence score; margin variables.","VAR-TBE-014","REF-TBE-005","Internal cost base or management fee decision, depending on approval.","Утверждаем ли этот location type фактор для Formula Sprint?","TO-BE","Approved for Formula Sprint","Test Assumption","","Use normalized registry example values and current local reference seeds for tests; replace with governed production values before release.",""
"TBE-HND-001","Item Handling / Crew Feasibility","Max Single Item Weight","maxSingleItemWeight = MAX(unitItemWeight)","Для решения one-person vs two-person смотрим вес самой тяжелой отдельной единицы, а не item weight x quantity. Quantity считается отдельно через totalPieces и totalWeight.","","Quote Draft item rows / Quick Quote catalog transfer; unit item weight per piece.","","REF-002; REF-TBE-005","One-person eligibility, min crew by item, pickup/delivery labor model.","Подтверждаем, что maxSingleItemWeight считается только по unit weight, без умножения на quantity?","TO-BE","Approved for Formula Sprint","Test Assumption","","Use normalized registry example values and current local reference seeds for tests; replace with governed production values before release.",""
"TBE-HND-002","Item Handling / Crew Feasibility","Heaviest Item Weight Class","weightClass = LOOKUP(maxSingleItemWeight, Item Handling Rules weight bands)","Самый тяжелый предмет переводится в weight class: light, standard, heavy, two-person required. Это предотвращает underpricing маленьких по объему, но тяжелых предметов.","","Max single item weight; Item Handling / Crew Feasibility Rules reference.","","REF-TBE-017","Crew requirement, helper logic, handling score.","Утверждаем ли item-level crew feasibility как обязательный блок Formula Sprint?","TO-BE","Approved for Formula Sprint","Test Assumption","","Use normalized registry example values and current local reference seeds for tests; replace with governed production values before release.",""
"TBE-HND-003","Item Handling / Crew Feasibility","One-Person Eligibility","onePersonEligible = maxSingleItemWeight <= onePersonMaxItemWeightLb AND noHardAccessConstraint AND noOversizedAwkwardItem","Заказ может быть кандидатом на delivery в одного человека, если самый тяжелый предмет не превышает approved threshold и нет ограничений access/oversized/awkward.","","Max item weight, access constraints, item flags, Location / Address Types reference.","VAR-HND-001","REF-TBE-005; REF-TBE-016","Delivery crew split, pickup crew split, labor cost.","Какой max single item weight утверждаем для one-person eligibility: 70 lb или другой threshold?","TO-BE","Approved for Formula Sprint","Test Assumption","","Use normalized registry example values and current local reference seeds for tests; replace with governed production values before release.",""
"TBE-HND-004","Item Handling / Crew Feasibility","Minimum Crew By Item","minCrewByItem = MAX(ItemHandlingRules[item].minCrew)","Каждый item может требовать minimum crew. Итоговый crew не может быть ниже максимального требования по любому предмету в заказе.","","Item catalog, item handling rules, custom item overrides.","","REF-003; REF-TBE-005","Recommended crew, labor hours, payroll cost.","Утверждаем ли item-level crew feasibility как обязательный блок Formula Sprint?","TO-BE","Approved for Formula Sprint","Test Assumption","","Use normalized registry example values and current local reference seeds for tests; replace with governed production values before release.",""
"TBE-HND-005","Item Handling / Crew Feasibility","Large Volume Light Item Exception","largeLightEligible = totalEffectiveVolume > largeLightItemVolumeThresholdCuFt AND maxSingleItemWeight <= onePersonMaxItemWeightLb AND itemHandlingScore < threshold","Большой общий объем сам по себе не должен автоматически означать 2+ crew, если заказ состоит из легких предметов вроде стульев/кресел и каждый предмет доступен для одного человека.","","Total effective volume, max single item weight, item handling score, item catalog.","VAR-HND-001; VAR-HND-005; VAR-HND-006","REF-003; REF-TBE-005","Crew split, labor time model, CEO approval trace.","Разрешаем ли large-volume/light-item exception для chairs/armchairs и похожих заказов?","TO-BE","Approved for Formula Sprint","Test Assumption","","Use normalized registry example values and current local reference seeds for tests; replace with governed production values before release.",""
