"Formula ID","Block","Name","Formula","Description","Level / Stage","Input / Source","Variable IDs","Reference IDs","Output / Next","Used In","Source Scope","Implementation Status","Data Readiness","Related Formula IDs","Test Assumption","Normalization Notes"
"TBE-HND-006","Item Handling / Crew Feasibility","Item Handling Score","itemHandlingScore = weightScore + sizeScore + awkwardnessScore + fragilityScore + packagingScore + accessInteractionScore","Score объясняет, почему предмет требует больше времени/людей: вес, габарит, неудобная форма, хрупкость, упаковка и взаимодействие с access условиями.","","Item rows, item catalog flags, packaging, protection, access/location references.","VAR-LAB-005","REF-003","Minimum handling minutes, crew requirement, risk reserve.","Утверждаем ли item-level crew feasibility как обязательный блок Formula Sprint?","TO-BE","Approved for Formula Sprint","Test Assumption","","Use normalized registry example values and current local reference seeds for tests; replace with governed production values before release.",""
"TBE-HND-007","Item Handling / Crew Feasibility","Crew Requirement From Items","crewFromItems = IF(onePersonEligible, 1, MAX(minCrewByItem, crewByHandlingScore))","Crew от items считается отдельно от route/location/access. Это защищает от ситуации, когда volume маленький, но предмет требует 2 человек.","","One-person eligibility, item min crew, handling score.","","REF-TBE-005","Final pickup crew, final delivery crew, labor hours.","Утверждаем ли item-level crew feasibility как обязательный блок Formula Sprint?","TO-BE","Approved for Formula Sprint","Test Assumption","","Use normalized registry example values and current local reference seeds for tests; replace with governed production values before release.",""
"TBE-HND-008","Item Handling / Crew Feasibility","Final Stage Crew Requirement","stageCrew = MAX(baseCrew, crewFromItems, crewFromAccess, crewFromLocation, manualCrewOverride)","Итоговый crew для pickup/delivery берется как максимум из item, access, location и manual override. Так ни один риск не затирается другим блоком.","","Item handling rules, access conditions, location type, broker/manual override.","","REF-011; REF-TBE-005","Pickup labor hours, delivery labor hours, payroll cost, final price.","Утверждаем ли item-level crew feasibility как обязательный блок Formula Sprint?","TO-BE","Approved for Formula Sprint","Test Assumption","","Use normalized registry example values and current local reference seeds for tests; replace with governed production values before release.",""
"TBE-HND-009","Item Handling / Crew Feasibility","Item Minimum Handling Time Floor","stageItemTimeFloor = SUM(itemMinimumHandlingMinutes x quantity x handlingComplexityMultiplier)","Даже если volume небольшой, каждый предмет имеет minimum handling time. Это защищает расчет от занижения labor для тяжелых или неудобных единичных предметов.","","Item Handling Rules, item quantity, handling class.","VAR-HND-004; VAR-LAB-005","REF-TBE-005","Pickup/delivery time floor, labor cost.","Утверждаем ли item-level crew feasibility как обязательный блок Formula Sprint?","TO-BE","Approved for Formula Sprint","Test Assumption","","Use normalized registry example values and current local reference seeds for tests; replace with governed production values before release.",""
"TBE-HND-010","Item Handling / Crew Feasibility","Stage Time Guardrail","stageMinutes = MAX(orderLevelTimeModelMinutes, stageItemTimeFloor)","Финальное время stage не может быть ниже суммы item-level minimum handling time. Order-level volume model и item-level floor работают вместе.","","Order time model, item minimum handling floor.","","REF-TBE-005","Pickup/delivery labor cost, margin guardrail.","Утверждаем ли item-level crew feasibility как обязательный блок Formula Sprint?","TO-BE","Approved for Formula Sprint","Test Assumption","","Use normalized registry example values and current local reference seeds for tests; replace with governed production values before release.",""
"TBE-HND-011","Item Handling / Crew Feasibility","Unit Item Weight","unitItemWeight = item.weight","Фиксирует вес одной физической единицы. Это защищает от ошибки, когда 10 легких предметов по 20 lb превращаются в один фиктивный heavy item 200 lb.","","Quote Draft item row / catalog default / broker override.","","REF-001","Max single item weight, heavy piece count, one-person eligibility.","Утверждаем как обязательный item-handling guardrail?","TO-BE","Approved for Formula Sprint","Ready","","",""
"TBE-HND-012","Item Handling / Crew Feasibility","Total Pieces","totalPieces = SUM(item.quantity)","Считает количество мест/единиц в заказе. Piece count влияет на время обработки, но не должен сам создавать heavy item.","","Quote Draft item quantities / Quick Quote transfer.","","","Piece handling minutes, trip/load complexity, UAT trace.","Утверждаем как обязательный item-handling guardrail?","TO-BE","Approved for Formula Sprint","Ready","","",""
"TBE-HND-013","Item Handling / Crew Feasibility","Heavy Piece Count","heavyPieceCount = SUM(IF(unitItemWeight >= heavyPieceWeightThresholdLb, quantity, 0))","Считает, сколько физических единиц являются тяжелыми. Один тяжелый предмет задает crew floor, а несколько тяжелых предметов увеличивают helper active time.","","Unit item weight, quantity, Item Handling Rules.","VAR-HND-007","","Crew requirement, helper active minutes, stage time floor.","Утверждаем как обязательный item-handling guardrail?","TO-BE","Approved for Formula Sprint","Test Assumption","","Use normalized registry example values and current local reference seeds for tests; replace with governed production values before release.",""
"TBE-HND-014","Item Handling / Crew Feasibility","Piece Handling Time","pieceHandlingMinutes = SUM(quantity x minutesPerPieceByHandlingClass)","Каждое место требует минимального времени обработки. Это закрывает кейс 35 легких мест, где общий вес небольшой, но физически много операций.","","Item Handling Rules, handling class, item quantity.","VAR-HND-009","REF-TBE-005","Stage item time floor, pickup/delivery labor minutes.","Утверждаем как обязательный item-handling guardrail?","TO-BE","Approved for Formula Sprint","Test Assumption","","Use normalized registry example values and current local reference seeds for tests; replace with governed production values before release.",""
"TBE-HND-015","Item Handling / Crew Feasibility","Helper Active Minutes","helperActiveMinutes = SUM(heavyPieceHandlingMinutes + accessHeavyImpactMinutes)","Считает время, когда второй человек действительно нужен для тяжелых/сложных предметов. Это позволяет не умножать весь stage на 2, если helper нужен только на часть работ.","","Heavy piece count, item handling minutes, access constraints.","VAR-HND-013","REF-TBE-005","Partial helper labor, payroll cost, margin guardrail.","Считаем helper на весь stage или только active helper minutes?","TO-BE","Approved for Formula Sprint","Test Assumption","","Use normalized registry example values and current local reference seeds for tests; replace with governed production values before release.",""
"TBE-HND-016","Item Handling / Crew Feasibility","Labor Hours With Partial Helper","laborHours = soloMinutes / 60 + helperActiveMinutes / 60","Разделяет базовое время одного исполнителя и активное время helper. Используется, если бизнес не хочет считать 2 человека на весь stage.","","Stage minutes, helper active minutes, helper billing policy.","","REF-TBE-005","Stage labor cost, fully loaded labor, price floor.","Считаем helper на весь stage или только active helper minutes?","TO-BE","Approved for Formula Sprint","Test Assumption","","Use normalized registry example values and current local reference seeds for tests; replace with governed production values before release.",""
"TBE-HND-017","Item Handling / Crew Feasibility","Hard Access Crew Rule","IF heavyItem AND hardAccessConstraint THEN minCrew = 2 OR manualReview = TRUE","Если тяжелый предмет сочетается со stairs/no elevator/long carry/narrow access, система должна поднимать min crew или отправлять заказ на manual review.","","Heavy item flags, Access Conditions, Location / Address Types, Physical Access Feasibility Rules.","","REF-011; REF-TBE-005; REF-TBE-016; REF-TBE-018","Final stage crew, access risk, labor cost, approval workflow.","Какие access constraints являются hard blockers для одного человека?","TO-BE","Approved for Formula Sprint","Test Assumption","","Use normalized registry example values and current local reference seeds for tests; replace with governed production values before release.",""
"TBE-VEH-002","Vehicle","Vehicle Dimensional Fit","vehicleDimensionalFit = itemLength <= cargoInteriorLengthIn AND itemWidth <= cargoInteriorWidthIn AND itemHeight <= cargoInteriorHeightIn","Проверяет, входит ли самый крупный item в реальные внутренние габариты кузова. Это отдельная проверка от общего volume/payload.","","Item dimensions; Vehicle Dimensions / Cargo Body Specs reference.","VAR-VEH-004; VAR-VEH-005; VAR-VEH-006","REF-TBE-019","Vehicle selection, manual review, box truck recommendation.","Утверждаем как обязательный vehicle fit guardrail?","TO-BE","Approved for Formula Sprint","Test Assumption","FIT-001-DIMENSIONAL-FIT","Use normalized registry example values and current local reference seeds for tests; replace with governed production values before release.",""
"TBE-VEH-003","Vehicle","Door Opening Fit","doorOpeningFit = itemWidth <= doorOpeningWidthIn AND itemHeight <= doorOpeningHeightIn","Даже если item помещается внутри кузова, он может не пройти через задний/боковой проем. Это должно давать warning/manual review.","","Item dimensions; vehicle door opening dimensions.","VAR-VEH-007; VAR-VEH-008","","Physical feasibility, manual review, vehicle upgrade.","Утверждаем как обязательный vehicle fit guardrail?","TO-BE","Approved for Formula Sprint","Test Assumption","","Use normalized registry example values and current local reference seeds for tests; replace with governed production values before release.","Review mapping: Reference mapping"
"TBE-VEH-004","Vehicle","Selected Vehicle Height Check","selectedVehicleHeightExceeded = itemHeight > selectedVehicle.cargoInteriorHeightIn","Проверяет не абстрактный threshold, а фактическую высоту кузова выбранной в заявке машины. Если item выше кузова выбранной машины, нужен review и подбор vehicle с более высоким кузовом.","","Item height from Quote Draft item row / catalog; selected vehicle cargoInteriorHeightIn from Vehicle Dimensions / Cargo Body Specs.","VAR-VEH-006","REF-001; REF-TBE-019","Vehicle revision, side transport review, box truck recommendation, snapshot warning.","Подтверждаем, что height flag сравнивает itemHeight с высотой выбранной машины, а не с глобальным 72 in?","TO-BE","Approved for Formula Sprint","Test Assumption","","Use normalized registry example values and current local reference seeds for tests; replace with governed production values before release.",""
"TBE-VEH-005","Vehicle","Side Transport Review","sideTransportReview = selectedVehicleHeightExceeded AND sideTransportAllowed IS NOT TRUE","Если item не входит по высоте в выбранную машину, нельзя автоматически считать, что его повезут на боку. Если side transport не подтвержден, заказ требует review.","","Selected vehicle height check, item handling rules, packaging/protection, broker/ops approval.","VAR-VEH-002","","Manual review, protection/packaging risk, vehicle requirement.","Кто подтверждает перевозку на боку и где сохраняем approval?","TO-BE","Approved for Formula Sprint","Test Assumption","","Use normalized registry example values and current local reference seeds for tests; replace with governed production values before release.","Review mapping: Reference mapping"
"TBE-VEH-006","Vehicle","Higher Body Vehicle / Box Truck Recommended","higherBodyVehicleRecommended = selectedVehicleHeightExceeded AND sideTransportAllowed = FALSE","Если item выше кузова выбранной машины и перевозка на боку не подтверждена, система должна предложить пересмотреть выбранный truck на машину с более высоким кузовом, включая Box Truck если он подходит.","","Selected vehicle height check, side transport approval, Vehicle Dimensions reference.","VAR-VEH-002","","Vehicle selection, quote warning, route cost, final price.","Когда higher body vehicle обязателен, а когда достаточно warning/manual review?","TO-BE","Approved for Formula Sprint","Test Assumption","FIT-005-RECOMMENDED-VEHICLE-CHANGE","Use normalized registry example values and current local reference seeds for tests; replace with governed production values before release.","Review mapping: Reference mapping"
"TBE-VEH-007","Vehicle","Vehicle Equipment Requirement","equipmentRequired = rampRequired OR liftGateRequired OR tieDownRequired; vehicleEligible = vehicle has required equipment","Для некоторых oversized/tall/heavy items нужен ramp, liftgate или tie-down. Vehicle fit должен проверять не только размеры, но и оборудование.","","Item handling rules; vehicle equipment fields.","","REF-TBE-005","Vehicle eligibility, labor time, manual review.","Утверждаем как обязательный vehicle fit guardrail?","TO-BE","Approved for Formula Sprint","Test Assumption","","Use normalized registry example values and current local reference seeds for tests; replace with governed production values before release.",""
"TBE-VEH-008","Vehicle","Final Vehicle Eligibility","vehicleEligible = volumeFit AND payloadFit AND vehicleDimensionalFit AND doorOpeningFit AND equipmentFit","Финальная пригодность машины должна учитывать volume, weight, реальные габариты кузова, дверной проем и оборудование.","","Vehicle fit formulas, item dimensions, vehicle dimensions/equipment reference.","","","Selected vehicle, manual review, cost base.","Утверждаем как обязательный vehicle fit guardrail?","TO-BE","Approved for Formula Sprint","Test Assumption","","Use normalized registry example values and current local reference seeds for tests; replace with governed production values before release.","Review mapping: Reference mapping"
"TBE-CAP-005","Capacity / Density","Shipment Density","shipmentDensityLbPerCuFt = totalWeightLb / MAX(totalEffectiveVolumeCuFt, 1)","Показывает, насколько заказ тяжелый относительно занимаемого объема. Нужен, чтобы отличать легкий объемный заказ от тяжелого компактного заказа.","","Total weight из item rows; total effective volume из item calculation.","","","Capacity constraint, vehicle fit, interstate pricing.","Подтверждаем density как обязательный расчет для interstate?","TO-BE","Approved for Formula Sprint","Test Assumption","","Use normalized registry example values and current local reference seeds for tests; replace with governed production values before release.","Review mapping: Reference mapping"
"TBE-CAP-006","Capacity / Density","Vehicle Density Capacity","vehicleDensityCapacityLbPerCuFt = selectedVehiclePayloadLb / selectedVehicleCargoVolumeCuFt","Показывает среднюю плотность груза, которую выбранный транспорт может безопасно везти при полной загрузке по объему и весу.","","Vehicle body specs reference: payload, cargo volume.","VAR-CAP-001; VAR-CAP-002","","Density comparison, limiting factor selection.","Для каких типов транспорта density rule обязателен?","TO-BE","Approved for Formula Sprint","Test Assumption","INT-CAP-001-DENSITY-THRESHOLD","Use normalized registry example values and current local reference seeds for tests; replace with governed production values before release.","Review mapping: Reference mapping"
"TBE-CAP-007","Capacity / Density","Capacity Constraint Type","IF payloadUtilization > vehicleUtilization THEN Weight-limited ELSE Volume-limited","Определяет, что именно ограничивает заказ: вес или объем. Для подушек обычно volume-limited, для мрамора weight-limited.","","Payload utilization and volume utilization.","","","Pricing explanation, warning rules, route capacity pricing.","Показывать ли broker/admin причину ограничения?","TO-BE","Approved for Formula Sprint","Test Assumption","INT-CAP-004-CAPACITY-CONSTRAINT-SELECTOR; INT-CAP-006-VOLUME-LIMITED-LOAD; INT-CAP-007-WEIGHT-LIMITED-LOAD","Use normalized registry example values and current local reference seeds for tests; replace with governed production values before release.","Review mapping: Reference mapping"
"TBE-CAP-008","Capacity / Density","Limiting Capacity Factor","limitingCapacityFactor = MAX(vehicleUtilization, payloadUtilization)","Для pricing берется больший процент загрузки: если объем занят на 30%, а вес на 70%, стоимость capacity должна считаться от 70%.","","Vehicle utilization and payload utilization.","","","Interstate capacity cost, bulky premium, margin guardrail.","Используем MAX utilization как главный cost driver?","TO-BE","Approved for Formula Sprint","Test Assumption","INT-CAP-005-INTERSTATE-COST-BASIS","Use normalized registry example values and current local reference seeds for tests; replace with governed production values before release.","Review mapping: Reference mapping"
"TBE-CAP-009","Capacity / Density","Interstate Capacity Cost","interstateCapacityCost = fullRouteCapacityCost * limitingCapacityFactor","Считает долю стоимости interstate truck/route, которую занимает заказ, с учетом и объема, и веса.","","Route cost reference, selected interstate vehicle, limiting capacity factor.","VAR-CAP-003","REF-TBE-005","Interstate subtotal, final cost base.","Full route capacity cost брать из route reference или вычислять по miles/fuel/labor?","TO-BE","Approved for Formula Sprint","Test Assumption","INT-CAP-005-INTERSTATE-COST-BASIS","Use normalized registry example values and current local reference seeds for tests; replace with governed production values before release.",""
"TBE-CAP-010","Capacity / Density","Legacy Dual Cost Guardrail","interstateCapacityCost = MAX(totalEffectiveVolume * costPerCuFt, totalWeight * costPerLb)","Альтернативный guardrail из старой логики: считаем цену по объему и по весу, затем берем большее значение, чтобы не недооценить тяжелые компактные заказы.","","Cost per cubic foot and cost per pound variables/reference.","","","Interstate subtotal or margin guardrail.","Оставляем dual cost как основной метод или как guardrail?","TO-BE","Approved for Formula Sprint","Test Assumption","INT-CAP-005-INTERSTATE-COST-BASIS","Use normalized registry example values and current local reference seeds for tests; replace with governed production values before release.","Review mapping: Variable mapping, Reference mapping"
"TBE-CAP-011","Capacity / Density","Capacity Overflow Flag","capacityOverflowFlag = vehicleUtilization > 1 OR payloadUtilization > 1","Ставит красный флаг, если заказ не помещается в выбранный транспорт по объему или payload.","","Vehicle utilization, payload utilization.","","","Warnings, vehicle recommendation, quote approval.","Блокировать quote или отправлять на manager approval?","TO-BE","Approved for Formula Sprint","Test Assumption","","Use normalized registry example values and current local reference seeds for tests; replace with governed production values before release.","Review mapping: Reference mapping"
"TBE-TIME-011","Time / Labor","Historical Time Calibration","timeCoefficient = calibrated from measured historical stop/stage time","Коэффициенты времени должны опираться на реальные замеры заказов, а не на догадку. В транскрибе обсуждалась база около 100 заказов.","","Historical Time Metrics reference.","","REF-TIME-001","Pickup/delivery/loading/unloading time model.","Какая выборка считается достаточной для утверждения коэффициентов?","TO-BE","Approved for Formula Sprint","Test Assumption","","Use normalized registry example values and current local reference seeds for tests; replace with governed production values before release.","Review mapping: Variable mapping"
"TBE-TIME-012","Time / Labor","Pickup Loading Minutes","pickupLoadingMinutes = loadingFormula(totalEffectiveVolume) + weightHandlingMinutes + accessTimeImpact","Считает время погрузки на pickup с учетом объема, веса и условий доступа.","","Item volume/weight, loading variables, access conditions.","VAR-TIME-006; VAR-TIME-007; VAR-TIME-008; VAR-TIME-009; VAR-TIME-010","REF-011; REF-TBE-005","Pickup labor cost, crew paid minutes.","Считать pickup всегда дольше delivery или по отдельным коэффициентам?","TO-BE","Approved for Formula Sprint","Test Assumption","LAB-TIME-001-VOLUME-BASED-HANDLING-TIME; LAB-TIME-002-WEIGHT-BASED-HANDLING-TIME; LAB-TIME-003-HANDLING-TIME-SELECTOR; LAB-TIME-006-PICKUP-TIME-COEFFICIENT","Use normalized registry example values and current local reference seeds for tests; replace with governed production values before release.",""
"TBE-TIME-013","Time / Labor","Delivery Unloading Minutes","deliveryUnloadingMinutes = pickupLoadingMinutes * unloadingTimeCoefficient","Delivery обычно быстрее pickup, поэтому unloading coefficient должен быть отдельной переменной, а не скрытой константой.","","Pickup loading minutes; unloading coefficient variable.","VAR-TIME-011","REF-TBE-005","Delivery labor cost, delivery subtotal.","Какой коэффициент unloading утвердить на MVP?","TO-BE","Approved for Formula Sprint","Test Assumption","LAB-TIME-004-PICKUP-DELIVERY-TIME-SPLIT; LAB-TIME-007-DELIVERY-TIME-COEFFICIENT","Use normalized registry example values and current local reference seeds for tests; replace with governed production values before release.",""
"TBE-TIME-014","Time / Labor","Helper Paid Minutes","helperPaidMinutes = MAX(helperActiveMinutes, helperMinimumBillableMinutes)","Если нужен helper, оплачиваемое время не должно быть меньше минимального порога, даже если активная работа заняла меньше.","","Helper active minutes, helper minimum billable minutes.","","","Payroll, margin, final price.","Minimum helper time = 2 часа?","TO-BE","Approved for Formula Sprint","Ready","LAB-TIME-005-MINIMUM-HANDLING-TIME","",""
