"ID","Блок","Формула / переменная","Формульный расчет","Описание логики на русском","Откуда берется","Куда передается","Статус согласования","Вопрос CEO"
"TBE-FEE-001","Custom Crate","Crate Cost","surfaceArea x materialPrice x wasteCoefficient + laborHours x laborRate + margin","Crate считается от площади внешних размеров, материала, waste/cuts, labor и margin.","Item dimensions, material reference, labor reference.","Packaging/crate subtotal.","Нужно утвердить","Кто дает material price и labor estimate?"
"TBE-FEE-002","Protection","RV / FVP / DV","RV = included; FVP = declaredValue x rate + fixedFee once per order; DV = future/confirmation","Protection pricing должен использовать declared value, а не item reference price. FVP fixed fee применяется один раз на order.","Protection plan field, declared value input, protection reference.","Protection cost, customer wording.","Нужно legal/finance approval","Какой rate/fixed fee/writing для FVP и DV?"
"TBE-FEE-003","Storage","Storage Cost","billableVolume x storageDays x storageRate","Storage остается отдельным cost component и должен сохранять совместимость со старыми estimate snapshots.","Item storage fields, volume, storage variables.","Service fees subtotal, snapshot.","Сохраняем compatibility","Меняем ли storage в Formula Sprint или только фиксируем?"
"TBE-ACC-001","Access","Floor / Elevator / COI","approved access rule by stage; avoid double-counting with labor time","Access условия могут быть fee или time impact, но не должны дублироваться в labor.","Floor, elevator, COI, stairs, long carry.","Pickup/delivery/service subtotal.","Нужно утвердить","Access считать fee, time impact или оба с guardrail?"
"TBE-MGN-001","Margin","Margin Application","marginAmount = approvedCostBase x marginRate","Margin применяется к утвержденной cost base в утвержденном порядке.","Stage subtotals, service fees, margin variable.","Raw customer price.","Нужно утвердить","Margin до или после broker fee?"
"TBE-MGN-002","Discount","Discount Guardrail","discount applies after approved margin/fee step and checks margin floor","Discount должен быть auditable и не должен ломать минимальную прибыльность.","Discount input, approval reason, margin floor.","Final raw price, audit.","Нужно определить формулу","Кто может давать discount и какой floor?"
"TBE-FINAL-001","Final Total","Rounding","finalCustomerPrice = CEILING(rawCustomerPrice, roundingIncrement)","Клиент видит округленную цену без лишних cents; raw price и rounding delta сохраняются внутри.","Raw customer price, rounding variable.","Estimate Document, snapshot.","Нужно утвердить","Округляем до $10 или другое правило?"
